book_id,goodreads_book_id,best_book_id,work_id,books_count,isbn,isbn13,original_publication_year,original_title,title,language_code,average_rating,ratings_count,work_ratings_count,description
5878,437885,437885,1385651,8,307960382,9780307960380,1992,"Frosty the Snowman (Little Golden Book)","Frosty the Snowman (Frosty the Snowman)",NULL,4.34,17540,17593,"kristin burn lived life philosophy think shoot picture struggling make end meet work nanny fabulously wealthy turnbull family looking two wonderful child waiting glamorous life new york photographer begin photograph considered elite manhattan art gallery seems might finally get chance start kristin major distraction forbidden love man dream almost keep breathless inexhaustible passion excitement within reach goal kristen ignores sign catastrophe exists reason kristin dismiss warning long searching desperately truth lens camera hope late novel psychological suspense stunning achievement thriller master james patterson one bestselling writer history new york sun"
5880,40158,40158,1124161,30,60841826,9780060841830,2000,"The Queen of Attolia","The Queen of Attolia (The Queen's Thief, #2)",NULL,4.23,23813,25299,"philip yancey help reveal two thousand year history covered upwhat happens respected christian journalist decides put preconception aside take long look jesus described gospel jesus new testament compare new rediscovered jesus even jesus think know well philip yancey offer new different perspective life christ work teaching miracle death resurrection ultimately came manger bethlehem cross jerusalem yancey present complex character generates question well answer disturbing exhilarating jesus want radically transform life stretch jesus never knew uncovers jesus brilliant creative challenging fearless compassionate unpredictable ultimately satisfying one meet jesus ever stay say yancey jesus rocked preconception made ask hard question u bear name better job following"
5885,49251,49251,235055,31,684848015,9780684848010,1997,"Citizen Soldiers: The U. S. Army from the Normandy Beaches to the Bulge to the Surrender of Germany","Citizen Soldiers: The U. S. Army from the Normandy Beaches to the Bulge to the Surrender of Germany",NULL,4.19,16322,16977,"set los angeles recent past birthplace graveyard american myth dream city harbour group people trapped beauty surroundings moral impoverishment novel chronicle voice"
5906,104734,104734,1146102,68,1860499260,9781860499260,1996,"The Vagina Monologues","The Vagina Monologues",NULL,3.86,17935,21359,"using crash object lesson manage portfolio irreverent vastly informative guide navigating turbulence market managing investment random walk wall street well established staple business shelf first book investor read taking plunge starting portfolio guide investing match need investor age bracket burton malkiel show analyze potential return stock bond also full range investment opportunity money market account real estate investment trust insurance home ownership tangible asset like gold want verse way market talking broker follow malkiel easy step managing portfolio book remains best investing guide money buy"
5910,6532496,6532496,6724608,20,385524986,9780385524990,2009,"Not My Daughter","Not My Daughter",NULL,3.77,17109,17905,"lilly haswell remembers everything whether want lilly toil father apothecary shop preparing herb remedy rote haunted memory mother disappearance villager whisper tale father refuse discus dream world travel adventure relative offer host london lilly discovers pleasure pitfall fashionable society suitor well clue mother lilly find searching truth past love future"
5914,41950,41950,1004492,64,752849522,9780752849520,2002,Quentins,Quentins,NULL,3.88,18150,19579,"struggling father death nina meet jared ryel presumably chance however soon becomes clear know even close friend father former associate begin following dark nina learns father man thought thief stole demon searching truth behind father death stumble upon something never expected something hell want hold key jared risk everything keep woman born save sharing secret sworn protect"
5931,20563,20563,21503633,390,375759018,9780375759020,1859,"Adam Bede","Adam Bede",NULL,3.77,17777,19423,"delightful sequel bestseller tender bone ruth reichl return tale love life marvelous meal comfort apple pick reichl story put chef toque embarks career restaurant critic pursuit good food good company lead new york china france los angeles story cooking dining chef range madcap sublime throughout reichl make every course hilarious instructive occasion novice expert alike share favorite recipe also sharing intimacy personal life style honest warm reader feel enjoying conversation meal friend"
5942,13586743,13586743,19174091,28,525952365,9780525952370,2009,"One Last Thing Before I Go","One Last Thing Before I Go",NULL,3.75,13763,15950,"would like free limitation soar beyond boundary day discover inner peace serenity untethered soul offer simple yet profound answer first exploration inner space devoted life inward journey book transform relationship world around discover put end habitual thought emotion limit consciousness tapping tradition meditation mindfulness author spiritual teacher michael singer show development consciousness enable u dwell present moment let go painful thought memory keep u achieving happiness institute noetic science ion untethered soul begin walking relationship thought emotion helping uncover source fluctuation inner energy delf free habitual thought emotion energy pattern limit consciousness finally perfect clarity book open door life lived freedom innermost"
5943,6609549,6609549,6803515,10,1423116186,9781423116190,2009,"By The Time You Read This, I'll Be Dead","By the Time You Read This, I'll Be Dead",NULL,3.89,18722,19562,"december jamaican general election two day bob marley play smile jamaica concert gunman stormed house machine gun blazing attack nearly killed reggae superstar wife manager injured several others marley would go perform free concert december left country next day return two spanning decade continent peopled wide range journalist drug dealer even brief history seven killing fictional exploration dangerous unstable time bloody aftermath street slum kingston crack war new york radically altered jamaica brilliantly inventive stunningly ambitious novel revealing modern epic secure marlon james place among great literary talent generation"
5945,21340,21340,22531,41,739317148,9780739317140,2005,"Dean Koontz's Frankenstein: City of Night ","City of Night (Dean Koontz's Frankenstein, #2)",NULL,3.97,15838,18580,"librarian note alternate cover isbn found resplendence william conqueror london court lovely saxon captive lady nicholaa forced choose husband assembled norman noble chose royce baron warrior whose fierce demeanor could conceal chivalrous tender heart resourceful rebellious utterly naive nicholaa vowed bend royce despite whirlwind feeling aroused ferocious battle seasoned passion royce surprised depth emotion whenever caressed charming climate utmost treachery saxon still intrigued norman invader royce nicholaa revelled precious new love fervent bond soon disrupted call blood kin country"
5947,6820,6820,1439,41,812966929,9780812966920,2001,number9dream,number9dream,NULL,3.92,13726,16451,"grand dynamic drive accumulation distribution capital question evolution inequality concentration wealth prospect economic growth lie heart political economy satisfactory answer hard find lack adequate data clear guiding theory capital century thomas piketty analyzes unique collection data twenty country ranging far back eighteenth century uncover key economic social pattern finding transform debate set agenda next generation thought wealth show modern economic growth diffusion knowledge allowed u avoid inequality apocalyptic scale predicted karl marx modified deep structure capital inequality much thought optimistic decade following world war ii main driver tendency return capital exceed rate economic threatens generate extreme inequality stir discontent undermine democratic value economic trend act god political action curbed dangerous inequality past piketty say may"
6005,15447,15447,2553145,28,345418506,9780345418500,1979,"The Source of Magic (Xanth, #2)","The Source of Magic (Xanth, #2)",NULL,3.86,19149,20720,"happens hunter becomes hunted gregg family hunting plain fun girl life next door plain horrible try polite try talk greggs laugh one day greggs go far little girl turn magic finger angry little girl magic finger take really control turned greggs bird know greggs living nest beginning"
6007,40470,40470,3049974,53,679747192,9780679747190,1996,"Cities of the Plain ","Cities of the Plain (The Border Trilogy, #3)",NULL,4.07,14638,15701,"ember walsh always quiet one enjoying book glass wine noise crowd club best friend asks come meet boy like ember world turned upside appears like mythical avenging angel inked gorgeous completely league one look ember longer want quiet want montgomery buried damaged past woman fighting one day meet angel suddenly want want determined overcome demon dark secret link past bring closer tear apart"
6010,953260,953260,2907344,31,786854448,9780786854450,2004,"The Kingdom Keepers","Disney after Dark (Kingdom Keepers, #1)",NULL,3.91,18193,20906,"jo bessie fanny move country find enchanted wood right doorstep magic faraway tree live magical character soon become new friend silky fairy saucepan man together visit strange land roundabout land land ice snow toyland land take want atop tree exciting adventure narrow escape"
6013,77735,77735,1755248,31,671721720,9780671721720,1993,"The Honor of the Queen","The Honor of the Queen (Honor Harrington, #2)",NULL,4.21,17274,20256,"field forest western new york state late several dozen idealist set live land founding becomes famous commune centered ground decaying mansion called arcadia house arcadia follows lyrical rollicking tragic exquisite utopian dream hopeful start heyday story told point view bit fascinating character first child born arcadia"
6014,805023,805023,2702382,46,671729462,9780671729460,1982,"My Sweet Audrina","My Sweet Audrina (Audrina, #1)",NULL,3.92,18549,19602,"touch feel book enhance toddler sensory world textured material material attached durable page toddler asked feel material look provided mirror"
6019,1617875,1617875,701268,39,385341326,9780385341320,2006,"My Best Friend's Girl","My Best Friend's Girl",NULL,4.02,14811,17072,"third installment significance series begin maggie caleb clutch new enemy virtuoso council deal consequence taking life watson council attempting take maggie away keep precious visionary safe must deal marla well determined undermine control use caleb maggie rare gift us wish destroy entirely maggie father bish threatened council forbids presense human peter family fight stand beside every step way save maggie father keep caleb maggie together corrupted council set keeping apart stop marla whatever sleeve maggie shock life discovers something real father may change everything everyone stay tuned story continues"
6032,1963638,1963638,1966734,40,1572245379,9781572245370,2007,"The Untethered Soul","The Untethered Soul: The Journey Beyond Yourself",NULL,4.27,14688,17543,"incomparable alice munro bestselling rapturously acclaimed runaway book extraordinary story love infinite betrayal surprise title story young woman though think want incapable leaving husband three story woman named juliet emotion complicate luster intimate relationship munro hand people writes age circumstance friend lover parent vivid neighbor miraculous gift make story real unforgettable back cover runawaychancesoonsilencepassiontrespassestrickspowers"
6038,202146,202146,22829,42,316159433,9780316159430,2003,"Flyboys: A True Story of Courage","Flyboys: A True Story of Courage",NULL,4.15,14011,14908,"unparalleled work history recreates battle changed world war ii new edition anniversary print first time year classic story invasion normandy book endures masterpiece living history compelling tale courage heroism glow tragedy longest day painstakingly recreates fateful hour preceded followed massive invasion normandy retell story epic battle would turn tide world fascism free europe grip nazi new edition longest day original photograph used first edition reassembled painstakingly reproduced text freshly reset book must follower history well anyone want better understand free nation prevailed time darkness enshrouded earth"
6047,4618728,4618728,4668682,15,312360401,9780312360400,2009,Honolulu,Honolulu,NULL,4.02,15663,17383,"narrowly surviving last operation gabriel allon wayward son israeli intelligence taken refuge behind wall vatican restoring one caravaggio greatest masterpiece early one morning summoned peter basilica monsignor luigi donati private secretary holiness pope paul vii body beautiful woman lie broken beneath michelangelo magnificent dome vatican police suspect suicide though gabriel belief otherwise seems donati monsignor fearful public inquiry might inflict another scandal church call upon gabriel quietly pursue one caveat rule number one vatican donati said ask many question gabriel learns dead woman uncovered dangerous secret threatens global criminal enterprise looting timeless treasure antiquity selling highest bidder network greed mysterious operative plotting act sabotage plunge world conflict apocalyptic proportion"
6049,107821,107821,6121267,29,375414959,9780375414950,2007,"Bridge of Sighs","Bridge of Sighs",NULL,3.79,17013,18274,"firefighter god know tough place knowing people love hardest thing imagine last thing jake bryan knew roar world trade center collapsing top fellow firefighter man hospital bed remembers nothing rushing teammate stairway south tower help trapped victim blasted building woman sitting bedside say wife jamie bryan anything help beloved husband regain memory storybook family life small daughter sierra mean helping jake rediscover one thing jamie never shared deep faith god jake fondest prayer wife impact beyond anything could possibly conceived one tuesday morning love story like none ever read tender poignant commemorating tragedy heroism september portraying power god faithfulness good man love"
6053,107664,107664,3327491,58,439680093,9780439680100,2005,"Raven's Gate","Raven's Gate (The Gatekeepers, #1)",NULL,3.9,18247,20257,"kerry mcgrath dedicated prosecutor devoted mother daughter face cut car accident kerry relieved plastic surgeon treat eminent charles smith kerry notice something bizarre two smith patient bear uncanny resemblance suzanne reardon young woman killed eleven year earlier would smith create murder victim chilling tale obsession america reigning queen suspense"
6065,4005310,4005310,4051626,34,670020532,9780670020540,2008,"Why Evolution Is True","Why Evolution Is True",NULL,4.15,14637,15439,"note book large print hard toughest case hit closest cross left hometown awful family tragedy better life nana mama washington dc looked cousin stefan accused horrible unthinkable murder cross drive south bree nana mama jannie ali starksville north carolina first time year back home discovers proud community luck local resident welcome open arm cross step family home horror childhood flood back learns really brings skill finding truth cousin case truth hard come town one feel safe ghost take cross way sugarcane field florida get pulled case local cop needing kind expertise string socialite murder ever grisly setting chasing many loose end brutal killer truth past justice cousin one answer might cross justice alex cross confronts deadliest personal case career propulsive thrill ride prof go home might kill"
6071,15843166,15843166,21585451,26,762447699,9780762447700,2013,NULL,"You Are a Badass: How to Stop Doubting Your Greatness and Start Living an Awesome Life",NULL,4.04,28346,30862,"ching book change one effort human mind place within universe exerted living influence china year interest spread west set dawn history book oracle book change deepened meaning ethical value attached oracular pronouncement became book wisdom eventually one five classic confucianism provided common source confucianist taoist philosophy wilhelm rendering ching german published presented time form intelligible general reader wilhelm translated many ancient chinese work wrote several book chinese philosophy civilization long resided china close association cultural leader gave unique understanding text ching english translation every effort made preserve wilhelm pioneering insight spirit edition completely reset contains new forward hellmut wilhelm one eminent american scholar chinese culture discus father textual method summarizes recent study ching west china new edition contains minor textual correction bibliographical revision index"
6073,32429,32429,2771826,54,425208435,9780425208430,1993,"Dragon Tears","Dragon Tears",NULL,3.72,17573,18455,"one powerful writer work stunning frankness losing daughter richly textured bit childhood married life husband john gregory dunne daughter quintana roo book joan didion examines thought fear doubt regarding child illness growing old blue night open july didion think back quintana wedding new york seven year today would wedding anniversary fact trigger vivid snapshot quintana malibu brentwood school holmby hill reflecting daughter also role parent didion asks candid question parent might feel failed either cue taken perhaps displaced could missed clearly seen finally perhaps remain unknown seamlessly woven incident didion see underscoring age something find hard acknowledge much le accept blue long light evening hour signal summer solstice opposite dying brightness also warning year magical thinking iconic book incisive electric honesty haunting profoundly moving"
6079,77161,77161,1357544,78,1594480036,9781594480030,2003,"Grass for His Pillow ","Grass for His Pillow (Tales of the Otori, #2)",NULL,4.01,15140,18061,"second myron bolitar novel edgar harlan coben young woman tragic death spiral shattering drama menace secret rage suddenly myron playing dangerous game valerie simpson tennis career skyrocketed headline belong player wrong side track valerie shot dead cold blood dropped outside stadium open sport agent myron bolitar investigates killing uncovers connection two player murder exclusive mainline club myron drawn dirty senator jealous mother find caught killer truth"
6104,16204,16204,3274683,473,1592243002,9781592243010,1878,"Daisy Miller","Daisy Miller",NULL,3.36,17118,20939,"judd stevens psychoanalyst faced critical case life penetrate mind murderer find arrested murder murdered people close stevens already killed one patient responsible someone overwhelmed problem neurotic driven compulsion madman murderer strike judd must strip away mask innocence criminal wear uncover inner emotion fear desire expose naked face beneath could"
6106,57605,57605,56119,11,307444058,9780307444060,1940,"Pat the Bunny (Touch and Feel Book)","Pat the Bunny",NULL,4.06,19187,19870,"new york time author god great provocative entertaining guided tour atheist agnostic thought age piece salman rushdie ian mcewan ayaan hirsi ali christopher hitchens continues make case splendidly godless universe gathering influential voice past present shaped side current raging debate hitchens erudite witty guide led wealth philosophy literature scientific inquiry including generous portion word lucretius benedict de spinoza charles darwin karl marx mark twain george eliot bertrand russell emma goldman mencken albert einstein daniel dennett sam harris richard dawkins many others lesser known set context commented upon christopher hitchens political literary journalist extraordinaire los angeles time atheist believer uncertain matter portable atheist speak engage every step way"
6141,1317181,1317181,19079807,8,185549664X,9781855496640,2003,NULL,"Harry Potter and the Order of the Phoenix (Harry Potter, #5, Part 1)",NULL,4.56,16249,16350,"one one child new york wealthiest taken hostage criminal crave money power want ask elite know price others pay luxurious lifestyle corrects ignorance killing detective michael bennett becomes clear murder linked must part greater public demonstration city thrown chaos forced team fbi agent emily parker two set capture killer begin public lesson yet deadly message entire city bestselling author brought alex cross novel come james patterson series yet suspense patterson delivers worst casel leave gasping breath shocking first page last exhilarating scene worst case thriller america storyteller"
6147,487445,487445,475721,31,385341598,9780385341590,1973,"The Onion Field","The Onion Field",NULL,4.13,15558,15999,"secret presidency revealed story one know hidden story love story since work national archive find story living beecher white young archivist spends day working important document government always keeper people story never part story clementine kaye beecher first childhood crush show national archive asking help tracking father beecher try impress showing secret vault president united state privately review classified document accidentally happen upon priceless dictionary belonged george underneath desk chair beecher clementine find suddenly entangled web deception conspiracy man dead beecher run race learn truth behind mysterious national treasure search lead discover coded ingenious puzzle conceals disturbing secret founding nation secret beecher soon discovers believe worth killing"
6157,23422,23422,812271,55,375725342,9780375725340,2002,"The Art of Travel","The Art of Travel",NULL,3.81,13100,14840,"quitting husband house moving back horrible family lady maccon becomes scandal london season third book nyt bestselling parasol protectorate victoria dismisses shadow council person explain anything lord akeldama unexpectedly leaf town top alexia attacked homicidal mechanical ladybug indicating ladybug fact london vampire much interested seeing alexia quite thoroughly lord maccon elect get progressively inebriated professor lyall desperately try hold woolsey werewolf pack together alexia flees england italy search mysterious templar know enough preternatural explain increasingly inconvenient condition may worse vampire armed third book parasol protectorate series comedy manner set victorian london full werewolf vampire dirigible parasol protectoratesoullesschangelessblamelessheartlesstimelessfor gail carriger check custard protocolprudenceimprudencecompetencereticencefinishing school ya etiquette espionagecurtsies conspiracieswaistcoats weaponrymanners mutiny"
6159,25066591,25066591,44146594,34,316407135,9780316407140,2015,"Cross Justice","Cross Justice (Alex Cross, #23)",NULL,4.22,8634,16401,"imajica epic beyond compare vast conception obsessively detailed execution apocalyptic resolution heart lie sensualist master art forger gentle whose life unravels encounter judith odell whose power influence destiny men vaster know pie pah alien assassin come hidden dimension one five great system called imajica world utterly unlike ruled peopled haunted specie whose life intricately connected gentle judith pie pah travel imajica uncover trail crime intimate betrayal leading revelation startling change reality forever"
6167,153492,153492,2422487,575,1419151126,9781419151120,1915,"The Thirty-Nine Steps","The 39 Steps (Richard Hannay, #1)",NULL,3.6,12704,21125,"james michener masterly chronicle south africa epic tale adventurer scoundrel minister best worst two continent carve empire vast wilderness van doorn family tree spring two great branch one nurture lush vineyard settle interior become first trekboers afrikaner nxumalos inhabitant peaceful village unchanged century unite warrior tribe powerful zulu nation wealthy saltwoods missionary settler join mass influence war politics ravage nation rivalry passion spill across land covenant story courage heroism love loyalty cruelty betrayal generation fight forge new world"
6175,8951,8951,3214277,49,316016659,9780316016650,2002,"The Lake of Souls (Cirque Du Freak, #10)","The Lake of Souls (Cirque Du Freak, #10)",NULL,4.19,16803,18281,"first published earning hemingway praise promising american writer contains several early hemingway classic including famous nick adam story volume introduces reader hallmark famous hemingway style lean tough prose enlivened ear colloquial eye realistic time provides key insight hemingway later work"
6180,30512,30512,2305040,61,2264022442,9782264022450,1993,"Paddy Clarke Ha Ha Ha","Paddy Clarke Ha Ha Ha",NULL,3.75,15044,16773,"coachman tried warn away ruined forbidding place rainswept cornish coast young mary yellan chose instead honor mother dying request join frightened aunt patience huge hulking uncle joss merlyn jamaica first glimpse raw november eve could sense inn dark power never mary dream would become hopelessly ensnared vile villainous scheme hatched within crumbling handsome mysterious stranger would incite passion tempting love man dare trust"
6183,47881,47881,847797,27,439545307,9780439545300,2006,"Charlie Bone and the Hidden King (The Children of the Red King, # 5)","Charlie Bone and the Hidden King (The Children of the Red King, #5)",NULL,3.98,18899,19344,"new york time bestselling author daniel silva delivers another stunning thriller latest tale high stake international intrigue featuring inimitable gabriel allon first english assassin english girl come english spy master novelist daniel silva thrilled reader seventeen thoughtful gripping spy novel featuring diverse cast compelling character ingenious plot taken around globe united state europe russia middle east brilliant hero gabriel restorer assassin joined pantheon great fictional secret agent including george smiley jack ryan jason bourne simon success smash hit heist daniel silva return another powerhouse novel showcase outstanding skill brilliant imagination sure must read multitude fan growing legion convert"
