book_id,goodreads_book_id,best_book_id,work_id,books_count,isbn,isbn13,original_publication_year,original_title,title,language_code,average_rating,ratings_count,work_ratings_count,description
45,4214,4214,1392700,264,770430074,9780770430080,2001,"Life of Pi","Life of Pi",NULL,3.88,1003228,1077431,"life pi fantasy adventure novel yann martel published protagonist piscine molitor pi patel tamil boy pondicherry explores issue spirituality practicality early age survives day shipwreck stranded boat pacific ocean bengal tiger named richard parker"
132,3431,3431,2561472,123,1401308589,9781401308580,2003,"The Five People You Meet in Heaven","The Five People You Meet in Heaven",NULL,3.9,449501,474699,"also see alternate cover edition isbn ace ace save mother life clary must travel city glass ancestral home shadowhunters never mind entering city without permission law breaking law could mean death make thing worse learns jace want simon thrown prison shadowhunters deeply suspicious vampire withstand clary uncovers family past find ally mysterious shadowhunter sebastian valentine mustering full force power destroy shadowhunters forever chance defeat fight alongside eternal enemy downworlders shadowhunters put aside hatred work together jace realizes exactly much willing risk clary harness newfound power help save glass city whatever cost love mortal sin secret past prove deadly clary jace face valentine third installment new york time bestselling series mortal instrument"
204,5326,5326,3097440,2380,1561797464,9781561797460,1843,"A Christmas Carol","A Christmas Carol",NULL,4.02,394540,441396,"girl selection chance lifetime opportunity escape life laid since birth swept world glittering gown priceless jewel live palace compete heart gorgeous prince america singer selected nightmare mean turning back secret love aspen caste leaving home enter fierce competition crown want living palace constantly threatened violent rebel america meet prince maxon gradually start question plan made realizes life always dreamed may compare future never imagined"
237,10592,10592,1552134,249,1416524304,9781416524300,1974,Carrie,Carrie,NULL,3.93,356814,377650,"zombie war came unthinkably close eradicating humanity max brook driven urgency preserving experience survivor apocalyptic year traveled across united state america throughout world decimated city teemed upwards thirty million soul remote inhospitable area planet recorded testimony men woman sometimes child came living least undead hell dreadful time world war z result never access document powerfully conveys depth fear horror also ineradicable spirit resistance gripped human society plague infamous village new dachang united federation china epidemiological trail began patient zero unnamed northern forest untold number sought terrible temporary refuge cold united state southern africa redeker plan provided hope humanity unspeakable price redoubt north american tide finally started turn invaluable chronicle reflects full scope duration zombie book capture haunting immediacy human dimension epochal event facing often raw vivid nature personal account requires degree courage part reader effort invaluable brook say introduction excluding human factor risking kind personal detachment history may heaven forbid lead u one day repeat end human factor true difference u enemy refer living dead note numerical factual material contained edition previously published auspex united nation postwar commission"
288,19691,19691,1112006,117,425172902,9780425172900,1984,"The Hunt for Red October","The Hunt for Red October (Jack Ryan Universe, #4)",NULL,4.01,270318,278255,"mindy kaling lived many life obedient child immigrant professional timid chubster afraid bike ben affleck impersonating performer playwright finally comedy writer actress prone starting fight friend coworkers sentence say one last thing swear shut perhaps want know mindy think make great best friend someone fill prescription middle night make great guy one aware elderly people room time act accordingly perfect amount fame famous never get convicted murder court law maintain trim figure find information page come right book mostly everyone hanging without mindy invite reader tour life unscientific observation romance friendship hollywood several conveniently placed stopping point run errand make phone call mindy kaling really girl next door much literally anywhere continental united state definitely live india sri lanka"
321,10365,10365,115,69,375806814,9780375806810,1961,"Where the Red Fern Grows","Where the Red Fern Grows",NULL,4.04,268548,280179,"unbearable lightness milan kundera tell story young woman love man torn love incorrigible womanizing one mistress humbly faithful lover magnificent novel juxtaposes geographically distant place brilliant playful reflection variety style take place perhaps major achievement one world truly great writer"
409,9375,9375,2129359,94,375508414,9780375508420,1987,"Fried Green Tomatoes at the Whistle Stop Cafe","Fried Green Tomatoes at the Whistle Stop Cafe",NULL,4.26,207508,216286,"workaholic attorney samantha sweeting done unthinkable made mistake huge wreck chance partnership going utter meltdown walk london office get train end middle nowhere asking direction big beautiful house mistaken interviewee find offered job housekeeper employer idea hired samantha idea work oven sew button bake potato get ironing board open take deep breath begin find story delicious bread learns bake old life ever catch want back"
413,7190,7190,1263212,1341,NULL,NULL,1844,"Les Trois Mousquetaires","The Three Musketeers",NULL,4.06,195274,221481,"first book alyson noël extraordinary new immortal series enter enchanting new world true love never dy horrible accident claim life family ever bloom see people aura hear thought know someone entire life story touching going way avoid human contact suppress ability branded freak new high everything change meet damen gorgeous exotic wealthy one silence noise random energy magic intense though peer straight soul ever drawn deeper enticing world secret mystery left question answer idea really thing know true falling deeply helplessly love"
465,14758,14758,964332,53,743495667,9780743495660,2002,"In Her Shoes","In Her Shoes",NULL,3.78,167400,174338,"thing never easy oscar sweet disastrously overweight lovesick dominican ghetto nerd home new jersey life mother rebellious sister oscar dream becoming dominican tolkien finding love may never get want thanks curse haunted oscar family generation dooming prison torture tragic accident love oscar still waiting first kiss recent victim diaz immerses u tumultuous life oscar history family large rendering genuine warmth dazzling energy humor insight experience ultimately endless human capacity persevere face heartbreak loss true literary triumph brief wondrous life oscar wao confirms junot diaz one best exciting voice time"
487,7670,7670,997271,122,60541814,9780060541810,1969,"The Andromeda Strain","The Andromeda Strain",NULL,3.87,173186,178917,"kahlil gibran masterpiece prophet one beloved classic time published translated twenty language american edition alone sold nine million prophet collection poetic essay philosophical spiritual inspirational gibran musing divided chapter covering sprawling topic love marriage child giving eating drinking work joy sorrow housing clothes buying selling crime punishment law freedom reason passion pain teaching friendship talking time good evil prayer pleasure beauty religion death"
553,107291,107291,1812101,135,045057458X,9780450574580,1991,"Needful Things","Needful Things",NULL,3.87,153821,161758,"often credited creating popular movie audience shakespeare kenneth branagh wanted many year bring screen complete version hamlet shakespeare greatest play film like play something everyone say ghost story thriller murder mystery great tragedy profoundly moving outstanding cast international actor including derek jacobi claudius julie christie gertrude kate winslet ophelia charlton heston player king robin williams osric gerard depardieu reynaldo branagh version play title role well direct sure go film beautiful volume includes branagh introduction screenplay adaptation shakespeare text color still production diary take u behind scene look shooting film"
605,40173,40173,2270522,24,61173398,9780061173390,2007,"Are You There, Vodka? It's Me, Chelsea","Are You There, Vodka? It's Me, Chelsea",NULL,3.85,127096,135734,"october pm graphic artist clay riddell heart boston brilliant autumn afternoon hell unleashed eye without warning carnage chaos reigned ordinary people fell victim basest animalistic apocalypse began ring cell phone"
640,83763,83763,1258566,113,61015725,9780061015720,2002,Prey,Prey,NULL,3.72,131352,136307,"following unexpected death father layken forced rock mother younger brother outwardly appears resilient tenacious inwardly losing cooper attractive new neighbor intriguing passion slam poetry unique sense humor within day introduction layken form intense emotional connection leaving layken renewed sense long intense first date slammed core shocking revelation force new relationship sudden halt daily interaction become impossibly painful struggle find balance feeling pull together secret keep apart"
738,9822,9822,839692,73,689862202,9780689862200,1971,"Mrs. Frisby and the Rats of NIMH","Mrs. Frisby and the Rats of NIMH (Rats of NIMH, #1)",NULL,4.13,135978,142350,"omnibus edition collect five wool book single volume first wool story released standalone short july due reviewer demand rest story released next six month story mankind clawing survival mankind edge world outside grown unkind view limited talk forbidden always hope dream dangerous people resident infect others optimism punishment simple given thing profess want allowed cover"
740,114345,114345,2852640,14,60529962,9780060529960,1953,"The Little House Collection","The Little House Collection (Little House, #1-9)",NULL,4.33,124320,128880,"make journey need leave analytical mind false created self ego behind first page eckhart tolle extraordinary book move rapidly significantly higher altitude breathe lighter air become connected indestructible essence eternal ever present one life beyond myriad form life subject birth although journey challenging eckhart tolle us simple language easy format guide phenomenon since first publication power one rare book power create experience reader one radically change life better"
741,33926,33926,33947,61,143035479,9780143035470,1998,"The Girls' Guide to Hunting and Fishing","The Girls' Guide to Hunting and Fishing",NULL,3.29,113977,118017,"internet star jenny lawson aka bloggess make literary debut jenny lawson realized mortifying moment one like pretend never fact one define u lawson take reader hilarious journey recalling bizarre upbringing rural texas devastatingly awkward high school year relationship husband victor chapter include stanley magical talking squirrel series angry note husband vagina fine thanks asking snuck dead cuban alligator picture caption one would believe thing without proof accompany text"
787,7821447,7821447,10860635,39,61992704,9780061992700,2010,"Sh*t My Dad Says","Sh*t My Dad Says",NULL,3.98,102560,116368,"originally titled child household tale complete grimm fairy tale contains essential bedtime story child worldwide better part two century brother grimm jacob wilhelm german linguist cultural researcher gathered legendary folklore aimed collect story exactly heard marked anniversary grimm fairy tale better way celebrate include story knickerbocker classic series featuring favorite classic including hansel gretel cinderella frog prince rapunzel snow white rumpelstiltskin dozen complete grimm fairy tale also accompanied color plate black white illustration english illustrator arthur rackham whose book print highly third title knickerbocker classic series page classic fairy tale enjoy also feature binding ribbon marker fit neatly elegant slipcase personal library includes selection stunning color reproduction famous illustrator arthur rackham"
790,6596,6596,376130,82,1878424505,9781878424500,1997,"The Four Agreements: A Practical Guide to Personal Freedom, A Toltec Wisdom Book","The Four Agreements: A Practical Guide to Personal Freedom",NULL,4.12,97016,112472,"ace isbn act like teenager single still feeling cool read right magazine go right club know trainer wear also discovered great way score woman single parent group full available grateful mother waiting mr nice guy meet marcus oldest world marcus bit strange listens joni mitchell mozart look mum never even owned pair trainer perhaps teach marcus kid marcus help grow start act age"
798,7770,7770,98895,49,7173687,9780007173690,1960,"One Fish, Two Fish, Red Fish, Blue Fish","One Fish, Two Fish, Red Fish, Blue Fish",NULL,4.12,117582,122653,"family ancient curse girl change life forever tohru honda orphan place go mysterious sohma family offered place call home ordinary high school life turned upside introduced sohma world magical curse family secret"
799,32423,32423,2200683,99,NULL,9780425188800,1987,Watchers,Watchers,NULL,4.16,109595,113984,"alternate edition isbn edition includes freshly edited text based best early printed version full explanatory note conveniently placed page facing text plot key famous line introduction reading shakespeare essay outstanding scholar providing modern perspective illustration folger shakespeare library vast holding rare book"
843,13584236,13584236,19171215,31,345803574,9780345803570,2012,NULL,"Fifty Shades Trilogy (Fifty Shades, #1-3)",NULL,4.13,76876,101613,"six thing wrong one spot never come head lurk red way next two sister may peed somewhere fourteen day summer hols back stalag oberfuhrer frau simpson bunch sadistic ugly need go ugly went party dressed stuffed wildly funny journal year life georgia nicolson british author louise rennison perfectly captured soaring joy bottomless angst teenager spirit bridget jones diary fresh irreverent simply hilarious book leave laughing loud georgia would say fabbity fab fab"
913,327847,327847,318479,63,684818701,9780684818700,1931,"The Joy of Cooking","The Joy of Cooking",NULL,4.14,102348,105920,"despite constant effort declutter home paper still accumulate like snowdrift clothes pile like tangled mess noodle japanese cleaning consultant marie kondo take tidying whole new level promising properly simplify organize home never method advocate approach doom pick away pile stuff forever konmari method revolutionary system lead lasting result fact none kondo client lapsed still waiting list detailed guidance determining item house spark joy international best seller featuring tokyo newest lifestyle phenomenon help clear clutter enjoy unique magic tidy home calm motivated mindset inspire"
958,3579,3579,7365,40,553609416,76783609419,1908,"The Complete Anne of Green Gables Boxed Set","The Complete Anne of Green Gables Boxed Set (Anne of Green Gables, #1-8)",NULL,4.42,92142,93067,"almost two year kiera boyfriend denny everything ever wanted loving tender endlessly devoted head new city start life together denny dream job kiera university everything seems perfect unforeseen obligation force happy couple lonely confused need comfort kiera turn unexpected local rock star named kellan kyle first purely friend lean loneliness grows relationship one night everything change none ever"
963,5350,5350,1110983,118,385339100,9780385339100,1997,"The Partner","The Partner",NULL,3.89,86870,91921,"ten year ago calamity came burst sky gave ordinary men woman extraordinary power awed public started calling epic epic friend man incredible gift came desire rule rule man must crush fight epic nobody reckoner shadowy group ordinary human spend life studying epic finding weakness assassinating david want want steelheart epic said invincible epic killed david father year like reckoner david studying planning something need object seen steelheart bleed want revenge"
966,425029,425029,7732,110,446350982,9780446350980,1986,"Presumed Innocent","Presumed Innocent",NULL,4.1,91774,93835,"gretchen rubin epiphany one rainy afternoon unlikeliest place city bus day long year short realized time passing focusing enough thing really moment decided dedicate year happiness lively compelling account rubin chronicle adventure twelve month spent wisdom age current scientific research lesson popular culture happier among thing found novelty challenge powerful source happiness money help buy happiness spent wisely outer order contributes inner calm smallest change make biggest difference"
976,90072,90072,24501333,3,793551617,9780793551610,NULL,NULL,"Dr. Seuss's Green Eggs and Ham: For Soprano, Boy Soprano, and Orchestra",NULL,4.44,90574,90691,"country world body must find way live within profound work pivot biggest question american history ideal intimate concern father son coates offer powerful new framework understanding nation history current crisis american built empire idea race falsehood damage u fall heavily body black woman exploited slavery segregation today threatened locked murdered proportion like inhabit black body find way live within honestly reckon fraught history free burden world coates attempt answer question letter adolescent son coates share story awakening truth place world series revelatory experience howard university civil war battlefield south side chicago paris childhood home living room mother whose child life taken american plunder beautifully woven personal narrative reimagined history fresh emotionally charged reportage world clearly illuminates past bracingly confronts present offer transcendent vision way forward"
977,15645,15645,2377563,856,812970063,9780812970070,1320,Inferno,"Inferno (The Divine Comedy #1)",NULL,3.99,87511,109200,"john milton paradise lost one greatest epic poem english language tell story fall man tale immense drama excitement rebellion treachery innocence pitted corruption god satan fight bitter battle control mankind destiny struggle rage across three world heaven hell earth satan band rebel angel plot revenge god center conflict adam eve motivated human temptation whose ultimate downfall unyielding milton characteristic erudition paradise lost work epic scale notoriously ambition nearly year held generation upon generation audience rapt attention profound influence seen almost every corner western culture"
986,11564,11564,1836389,115,1416524290,9781416524300,1999,"The Girl Who Loved Tom Gordon","The Girl Who Loved Tom Gordon",NULL,3.56,95768,103156,"striking literary debut carol rifka brunt unfolds moving story love grief renewal two lonely people become unlikeliest friend find sometimes know lost someone found one person ever truly understood june elbus uncle renowned painter finn wei shy school distant older sister june finn company godfather confidant best friend dy far young mysterious illness mother barely speak june world turned upside finn death brings surprise acquaintance june help heal question think know finn family even heart finn funeral june notice strange man lingering beyond crowd day later receives package mail inside beautiful teapot recognizes finn apartment note toby stranger asking opportunity meet two begin spend time together june realizes one miss finn bring trust unexpected friend might one need emotionally charged novel tell wolf home tender story love lost found unforgettable portrait way compassion make u whole"
992,3090465,3090465,6440505,36,739352350,9780739352360,2005,"The Twilight Saga","The Twilight Saga (Twilight, #1-4)",NULL,3.88,89204,96811,"life little brother fudge make peter hatcher feel like fourth grade nothing whether fudge throwing temper tantrum shoe store smearing mashed potato wall hamburger heaven trying fly never far trouble almost terror get away everything peter fudge walk dribble peter pet turtle last straw peter put fudge long way long get parent pay attention change"
1012,13508607,13508607,19060869,89,1439152802,9781439152800,2012,"The Secret Keeper","The Secret Keeper",NULL,4.13,89460,100731,"overlord appeared suddenly every city intellectually technologically militarily superior humankind benevolent made demand unify earth eliminate poverty end war little rebellion humankind agreed golden age cost advent peace man cease strive creative greatness malaise settle human race resist becomes evident overlord agenda civilization approach crossroad overlord spell end humankind beginning"
1013,411053,411053,556134,88,696215322,9780696215320,1953,"Better Homes & Gardens New Cook Book","Better Homes and Gardens New Cook Book  ",NULL,4.14,93640,95085,"brave mouse covetous rat wishful serving girl princess named pea come together kate dicamillo newbery story despereaux tilling mouse love music story princess named pea also story rat called roscuro life darkness covets world filled light story miggery sow serving girl harbor simple impossible wish three character embark journey lead horrible dungeon glittering castle ultimately life happens kate dicamillo would say reader destiny find"
1054,13125947,13125947,14449480,51,525423664,9780525423670,2012,Reached,"Reached (Matched, #3)",NULL,3.56,109290,117859,"orphaned kit tyler know gaze first time cold bleak shore connecticut colony new home never like shimmering caribbean island left behind relative stern puritan community feel like tropical bird flown wrong part world bird caged lonely place kit feel completely free meadow enjoys company old quaker woman known witch blackbird pond occasion young sailor friend nat kit friendship witch discovered kit faced suspicion fear anger accused witchcraft"
1057,5348,5348,2777175,114,440234743,9780440234750,1999,"The Testament","The Testament",NULL,3.83,80377,86213,"one moment every drop blood body brought stop moment sprung earth stood figure solitary woman dressed head foot woman white famously open walter hartright eerie encounter moonlit london road engaged drawing master beautiful laura fairlie walter becomes embroiled sinister intrigue sir percival glyde friend count fosco taste white mouse vanilla bonbon poison pursuing question identity insanity along path corridor english country house madhouse woman white first influential victorian genre combined gothic horror psychological sweet introduction explores phenomenon victorian fiction discus wilkie collins biographical societal influence included edition appendix theatrical adaptation novel serialisation history"
1097,89375,89375,2957021,54,800759494,9780800759490,2004,"90 Minutes in Heaven","90 Minutes in Heaven: A True Story of Death and Life",NULL,3.91,67937,69968,"great divorce novel british author lewis published based theological dream vision reflects christian conception heaven hell"
1103,80568,80568,3164888,60,446613347,9780446613350,2001,"Sam's Letters To Jennifer","Sam's Letters to Jennifer",NULL,4.15,77538,79471,"new adventure lie ahead anne shirley pack bag wave childhood head redmond college old friend prissy grant waiting bustling city kingsport frivolous new friend philippa gordon side anne tuck memory rural avonlea away discovers life term filled surprise including marriage proposal worst fellow imaginable sale first story tragedy teach painful lesson tear turn laughter anne friend move old cottage ornery black cat steal heart little anne know handsome gilbert blythe want win heart suddenly anne must decide whether ready love"
1107,80536,80536,3111329,50,1416528636,9781416528630,2004,"Little Earthquakes","Little Earthquakes",NULL,3.76,77592,80501,"bc modern indian mistakenly call indus valley civilisation inhabitant period called land meluha near perfect empire created many century earlier lord ram one greatest monarch ever lived proud empire suryavanshi ruler face severe peril primary river revered saraswati slowly drying extinction also face devastating terrorist attack east land chandravanshis make matter worse chandravanshis appear allied naga ostracised sinister race deformed human astonishing martial skill hope suryavanshis ancient legend evil reach epic proportion seems lost appears enemy triumphed hero tibetan immigrant shiva really hero want hero drawn suddenly destiny duty well love shiva lead suryavanshi vengeance destroy evil"
1124,22206,22206,1311854,67,99437961,9780099437960,2002,Lullaby,Lullaby,NULL,3.73,66713,76680,"ravishing beauty unsettling intelligence michael ondaatje booker novel trace intersection four damaged life italian villa end world war ii hana exhausted nurse maimed thief caravaggio wary sapper kip haunted riddle english patient nameless burned man lie upstairs room whose memory passion betrayal rescue illuminates book like flash heat lightening"
1133,11713,11713,3009869,58,771068719,9780771068710,1992,"The English Patient","The English Patient",NULL,3.88,83741,92162,"cryptonomicon zoom world careening conspiratorially back forth two time war ii present hero brilliant mathematician lawrence waterhouse crypt analyst extraordinaire marine bobby shaftoe part detachment allied group trying break axis communication code simultaneously preventing enemy figuring code broken job boil layer upon layer deception alan turing also member explains unit strange working waterhouse want sink convoy send observation plane first course observe real already know exactly convoy real duty observed come round sink german find suspicious secrecy resonates story line grandchild wwii programming geek randy waterhouse lovely powerful amy help create offshore data southeast asia maybe uncover gold destined nazi coffer top paranoiac tone book mysterious enoch root key member detachment societas eruditorum pop unbreakable encryption scheme left wwii befuddle protagonist conspiratorial tie"
