book_id,goodreads_book_id,best_book_id,work_id,books_count,isbn,isbn13,original_publication_year,original_title,title,language_code,average_rating,ratings_count,work_ratings_count,description
7796,491735,491735,461588,32,312313829,9780312313820,2003,"The Dirty Girls Social Club","The Dirty Girls Social Club (Dirty Girls, #1)",NULL,3.46,11045,11639,"rowling delivered deeply affecting commencement speech harvard university published first time book form good life present rowling word wisdom anyone turning point life embrace failure use imagination better others drawing story year world famous author address life important question acuity emotional force"
7804,10778410,10778410,15690266,40,1611139856,9781611139850,2011,NULL,"The Fire (Witch & Wizard, #3)",NULL,3.87,11789,15877,"police officer shot detective michael bennett arrest infamous mexican crime lord deadly chase leaf bennett lifelong friend hughie mcdonough dead jail prisoner vow rain epic violence upon new york get revenge michael bennett judge murdered escape chaos bennett take ten kid beautiful nanny mary catherine vacation family cabin near newburgh new york instead calm happy town remembers growing step nightmare worse could ever imagined newburgh inferno warring gang little keep child safe target michael bennett violence overwhelms state bennett torn protecting hometown saving new york city partner investigation federal prosecutor tara mclellan brings new weapon attraction endangers relationship mary novel michael bennett james patterson personal thrilling best"
7805,71863,71863,2057013,53,439829127,9780439829120,1995,"The Third Day, The Frost","A Killing Frost (Tomorrow, #3)",NULL,4.19,13199,15090,"outside dina demille epitome normal run quaint victorian bed breakfast small texas town owns shih tzu named beast perfect neighbor whose biggest problem serve guest breakfast dina different broom deadly weapon inn magic think meant lodging otherworldly visitor permanent guest retired galactic aristocrat leave ground responsible death million someone might shoot sight circumstance normal bit stretch something wicked claw deepwater teeth begun hunt night feeling responsible neighbor dina decides get involved long juggle dealing annoyingly attractive new neighbor sean equally arresting cosmic vampire soldier arland trying keep inn guest safe enemy facing unlike anything ever encountered smart vicious lethal putting creature neighbor might cost everything"
7806,181077,181077,2029501,66,NULL,9780698118030,1977,"Sadako and the Thousand Paper Cranes","Sadako and the Thousand Paper Cranes",NULL,4.09,14578,16161,"day girl ca catch break first georgina kincaid succubus get energy seducing men ca sex gorgeous bestselling author boyfriend seth mortensen case inadvertently kill second georgina demonic order mentor new surprisingly inept succubus block third someone manipulating dream draining energy supplying eerie vision future georgina seek answer dante dream interpreter tie underworld flirtatious charm leaf confused especially situation seth reach crisis point georgina need rein love life go enemy capable wreaking serious havoc among mankind otherwise georgina entire mortal world may never sleep easy"
7813,6488483,6488483,6679864,22,1607061228,9781607061230,2010,"The Walking Dead Volume 11","The Walking Dead, Vol. 11: Fear the Hunters",NULL,4.33,13202,14777,"esv study bible designed help understand bible deeper way created diverse team leading bible scholar teacher country nearly denomination seminary college university esv study bible feature wide array study tool making valuable resource serious reader student teacher god size x lexicon type bible text frutiger type study note page black letter text concordance extensive article map illustration binding lifetime guarantee packaging hc clamshell box trutone leather permanent slipcase cloth board"
7820,15433,15433,17405,21,345418549,9780345418550,1982,"Night Mare (Xanth, #6)","Night Mare (Xanth, #6)",NULL,3.81,15008,15916,"autobiography chronicle remarkable life phil robertson original duck commander duck dynasty star early childhood founding family business life always getting way phil robertson passion duck quarterback phil made mark louisiana tech university playing football completing college career master degree english phil eye always book ball usually looking grew dream living simple life land like forebear soon found path bar drinking much fighting wasting talent almost lost gave life god everything incredible story tell followed calling god soon invented duck call would begin incredible journey life always dreamed family great love country family maker phil finally found ingredient good life always wanted"
7822,303098,303098,131682,66,3426619148,9783426619150,1998,Riptide,Riptide,NULL,3.93,11835,13883,"hunted last healer fifteen realm avry kazan unique position mind friend foe alike longer exists despite need prevent megalomanical king tohon winning control realm avry also determined find sister repair estrangement must alone kerrick partner sole confident return alga summon country hiding avry whatever support tohon opponent including infiltrating holy army evading magic sniffer teaching forest skill soldier figuring stop tohon horrible creation yet army walking animal alike nearly impossible coming avry alone unless figure impossible"
7829,93276,93276,89928,23,195019059,9780195019060,1860,"The Story of King Arthur","King Arthur and His Knights: Selected Tales",NULL,4.1,13286,13350,"new york time bestseller named best marketing book american marketing associationwhat make thing popular people talk certain product idea others story rumor infectious make online content go viral said advertising think people listen advertisement listen peer people talk certain product idea others story rumor infectious make online content go viral wharton marketing professor jonah berger spent last decade answering question studied new york time article make paper list product get word mouth social influence shape everything car buy clothes wear name give child book berger reveals secret science behind social transmission discover six basic principle drive sort thing become contagious consumer product policy initiative workplace rumor youtube combine groundbreaking research powerful story learn luxury steakhouse found popularity lowly commercial might actually increased drug use million consumer shared video one seemingly boring product blender wondered certain story get shared get forwarded video go viral contagious explains show leverage concept craft contagious content book provides set specific actionable technique helping information spread designing message advertisement information people share whether manager big company small business owner trying boost awareness politician running office health official trying get word contagious show make product idea catch"
7839,33335,33335,33417,22,743289803,9780743289800,2001,"The Hidden Messages in Water","The Hidden Messages in Water",NULL,4.27,10800,11156,"opinion one finest novel time graham greeneshusaku endo japan foremost novelist silence generally regarded masterpiece perfect fusion treatment theme powerful novel tell story portuguese priest japan height fearful persecution small christian community"
7840,759960,759960,1366476,52,440975344,9780440975340,1975,"Rumble Fish","Rumble Fish",NULL,3.77,14002,14999,"ever since child jem kept secret whenever meet someone new matter soon look eye number pop head number date date die burdened awful awareness jem avoids relationship meet spider another outsider take chance two plan trip city waiting ride eye ferris wheel jem terrified see tourist line flash number today number today date terrorist going attack london jem world explode"
7852,556629,556629,2101042,31,842339655,9780842339650,1984,"The Holiness of God","The Holiness of God",NULL,4.35,10960,11572,"scavenger specie circling truly provably end day gzilt ancient people organized military principle yet almost perversely peaceful gzilt helped set culture ten thousand year earlier nearly one founding society deciding join last moment made collective decision follow path million civilization going sublime elevating new almost infinitely rich complex preparation though regimental high command destroyed lieutenant commander reserve vyr cossont appears involved wanted dead alive aided ancient reconditioned android suspicious culture avatar cossont must complete last mission given high command must find oldest person culture man nine thousand year old might idea really happened time seems final day gzilt civilization likely prove perilous"
7853,858514,858514,1705201,18,688170277,9780688170270,2000,"Wemberly Worried","Wemberly Worried",NULL,4.22,14325,14500,"remote winter landscape brutal massacre kidnapping young iroquois girl violently deep rift two tribe girl captor bird one huron nation great warrior statesman year passed since murder family yet never far mind girl snow fall recognizes ghost lost daughter fight heart allegiance small battle erupt bigger war tribe face new dangerous threat huron christophe charismatic missionary found calling among tribe devotes learning understanding custom language emissary distant land brings much faith new world natural beauty three soul dance intricately woven act duplicity social political spiritual world collide new nation rise world flux"
7856,851678,851678,837187,16,739458736,9780743276950,2005,"What Remains: A Memoir of Fate, Friendship, and Love","What Remains: A Memoir of Fate, Friendship, and Love",NULL,4.16,9602,11631,"teenage murder witness drowned tub apple party hostile witnessed murder belief storm home within hour body found still house drowned tub night hercule poirot called find presence first must establish whether looking murderer"
7859,141077,141077,2266654,259,812968239,9780812968230,1889,"Крейцерова соната","The Kreutzer Sonata",NULL,3.9,10915,13242,"child speak different language sometimes wager attention time ignore completely sometimes filled gratitude affection time seem totally indifferent attitude behavior development everything depends love relationship child child feel loved best make sure child feel loved since gary chapman book five love language helped couple develop stronger fulfilling relationship teaching speak others love language child express receives love one five different communication style love language may totally different child show child love may hearing something completely child primary language learn effectively convey unconditional feeling respect affection commitment resonate child emotion behavior"
7861,257257,257257,249321,7,714847984,9780714847990,1996,"The 20th Century Art Book","The 20th Century Art Book",NULL,3.94,9927,10098,"one city hottest night new york police lieutenant eve dallas sent central park hellish new investigation victim found rock still dark water lake central park around neck single red ribbon hand posed prayer eye removed precision done careful hand surgeon dallas alarmed body turn defining scar eve frantic answer instinct accepts help psychic offer one vision another shockingly accurate detail murder partner friend peabody badly injured escaping attack stake raised eye symbol twisted religious ritual souvenir help husband roarke dallas must uncover killer motivation another vision becomes another nightmare"
7867,23245587,23245587,42788868,17,125004734X,9781250047340,2015,NULL,"Summer Secrets",NULL,3.62,10223,12179,"america queen suspense come gripping tale young woman trying unravel mystery family tragedy quest terrifying repercussion ten year since charles mackenzie mack went missing columbia university senior graduate already accepted duke university law school walked apartment manhattan upper west side without word college roommate never seen however make one ritual phone call mother every year mother day time assures fine refuse answer frantic question hang even death father corporate lawyer tragedy bring home break pattern sister carolyn law school graduate finished clerkship civil court judge manhattan endured two family tragedy yet realizes never able closure get life find brother resolve discover happened mack found necessary hide year mack make annual mother day call carolyn interrupt announce intention track matter take next morning mass uncle monsignor devon mackenzie receives scrawled message left collection basket uncle devon tell carolyn must look mack cryptic warning nothing deter sister taking search despite angry reaction mother olivia polite disapproval elliott wallace carolyn honorary uncle clearly love pursuit truth mack disappearance swiftly plunge world unexpected danger unanswered question secret gu lil kramer superintendent building mack living hide mack old roommate charismatic club owner nick demarco cold wealthy real estate tycoon bruce galbraith know mack disappearance nick connected disappearance leesey andrew last seen trendy club police possibly believe mack alive serial killer shadowy predator young woman mack also guilty brutal murder drama teacher theft taped session carolyn passionate search truth brother brother lead deadly confrontation someone close whose secret allow reveal"
7872,527862,527862,1087332,38,393312801,9780393312800,1994,"The Acid House","The Acid House",NULL,3.69,10752,11696,"julian treslove professionally unspectacular disappointed bbc worker sam finkler popular jewish philosopher writer television personality old school friend despite prickly relationship different life never quite lost touch former teacher libor sevcik czechoslovakian always concerned wider world exam result libor finkler recently widowed treslove chequered unsuccessful record woman rendering honorary third widower dine libor grand central london apartment sweetly painful evening reminiscence three remove time loved lost time fathered child devastation separation prized anything greatly enough fear loss better perhaps go life without knowing happiness way le mourn treslove find tear enough unbearable sadness friend loss evening exactly treslove hesitates moment outside window oldest violin dealer country walk home attacked whole sense slowly ineluctably change"
7873,685401,685401,962740,25,684856360,9780684856360,2014,NULL,"Permission Marketing: Turning Strangers Into Friends And Friends Into Customers",NULL,3.94,10146,10380,"summer man wearing cape top hat approach prostitute dark new york city street minute later woman dead left scene letter addressed lieutenant eve dallas inviting play game unveil identity sign jack dallas pursuit murderer know much history serial killer studied notorious vicious slaying modern time also want make mark chosen victim eve dallas eve know plan mimic infamous murderer starting jack ripper robb energetic prose dialogue keep reader engrossed publisher weekly edgy raw booklist"
7874,111126,111126,2457240,84,375727434,9780375727440,2001,"Hateship, Friendship, Courtship, Loveship, Marriage","Hateship, Friendship, Courtship, Loveship, Marriage: Stories",NULL,4.06,10945,12818,"loudmouthed redheaded cee cee bloom sight set hollywood bertie white quiet conservative dream getting married child childhood world collide atlantic city keeping touch pen pal reunite year always near moving novel follows cee cee bertie extraordinary friendship course thirty year transform adolescent adult bestselling novel became hugely successful film beach funny heartbreaking tale part every woman library"
7887,13451,13451,3048970,28,067103264X,9780671032650,1999,"Storm of the Century: An Original Screenplay","Storm of the Century: An Original Screenplay",NULL,3.86,14629,15343,"robyn carr new york time bestselling author popular virgin river novel come thunder highly anticipated new series make laugh make sigh make fall love small town filled people never forget nestled oregon coast small town rocky beach rugged charm local love land unspoiled beauty developer see potential gold mine newcomer hank cooper learns left old friend entire beachfront property find community destiny hand cooper never man settle one place thunder point supposed another quick stop cooper find getting involved town sarah dupre woman complicated beautiful whole town watching next move cooper choose old life place full new possibility place might home"
7894,3888,3888,7612,6,193361501X,9781933615010,2005,"The America's Test Kitchen Family Cookbook","The America's Test Kitchen Family Cookbook",NULL,4.31,12081,12292,"city bulikov wielded power god conquer world enslaving brutalizing million divine protector killed bulikov history censored erased citizen subjugated surreal landscape city forever altered thousand miracle guardian worked upon stand haunting reminder former broken city step shara thivani officially unassuming young woman another junior diplomat sent bulikov oppressor unofficially one country accomplished spy dispatched along terrifying secretary sigrud solve shara pursues killer start suspect being ruled terrible place may dead seem bulikov cruel reign may yet tale vast conspiracy dead god buried history city stair gripping spy novel stunningly original work fantasy"
7922,8643220,8643220,13521050,9,1595144293,9781595144290,2011,"Vampire Academy: The Graphic Novel","Vampire Academy: The Graphic Novel (Vampire Academy: The Graphic Novel, #1)",NULL,4.11,13445,13621,"returning visit daughter iraq joan scudamore find unexpectedly alone stranded isolated rest house flooding railway track sudden solitude compels joan ass life first time ever face many truth looking back year joan painfully attitude relationship action becomes increasingly uneasy person revealed"
7924,7469133,7469133,9552554,34,385532350,9780385532360,2010,"Dexter Is Delicious","Dexter Is Delicious (Dexter, #5)",NULL,3.79,13582,15277,"everybody smart different way judge fish ability climb tree live life believing ally smart enough fool lot smart people every time land new school able hide inability read creating clever yet disruptive distraction afraid ask help cure dumb however newest teacher daniel see bright creative kid underneath trouble maker help ally learns hard dyslexia nothing ashamed confidence grows ally feel free world start opening possibility discovers lot label great mind always think alike"
7927,339026,339026,1214027,50,439670209,9780439670200,2004,"The Akhenaten Adventure","The Akhenaten Adventure (Children of the Lamp, #1)",NULL,3.76,15306,16363,"change occurred electrical storm centered island nantucket produced blinding white flash rendered electronic device fuel inoperable follows terrible global catastrophe history human dark age universal complete could possibly imagined"
7953,7775841,7775841,10682678,11,1439157995,9781439157990,2010,NULL,"Sleepwalk With Me and Other Painfully True Stories",NULL,3.85,10790,11504,"promised meredith nine year safety gave three father supposed locked meredith turned eighteen thought time grow get start new life meredith fifteen today father coming home prison today time run"
7972,836984,836984,1563512,43,345450728,9780345450720,2002,"Distant Shores","Distant Shores",NULL,3.7,12174,14698,"based life paul gauguin moon sixpence somerset maugham ode powerful force behind creative genius charles strickland staid banker man wealth privilege also man possessed unquenchable desire create art strickland pursues artistic vision leaf london paris tahiti quest make sacrifice leave life closest tatter maugham sympathetic eye strickland tortured cruel soul becomes symbol blessing curse transcendent artistic genius cost human life sometimes demand"
7990,90078,90078,1689887,165,1406790273,9781406790280,1689,"An Essay Concerning Human Understanding","An Essay Concerning Human Understanding",NULL,3.82,11456,11957,"year meet mackenzie powerful dangerous eccentric lady could seen without ruin rumor surround tragic violence mistress dark appetite scandal set england scotland abuzz youngest brother ian known mad mackenzie spent young life asylum everyone agrees decidedly odd also hard handsome penchant ming pottery beautiful woman beth ackerley widow recently come fortune decided want drama life raised alcoholic father drove workhouse frail mother nurse death fussy old lady became constant companion want take money find peace travel learn art sit back fondly remember brief happy marriage late husband ian mackenzie decides want first new historical series"
7994,952,952,5166,35,1881273652,9781881273650,1995,"The Five Love Languages of Children","The Five Love Languages of Children",NULL,4.21,9744,12513,"wall street journal bestselling author kendra abducted way school fbi waste moment sending agent scour area embedding special agent ava mclane distraught family eye storm local detective mason callahan whose life crumbling related victim longtime confidential informant agent mclane hole victim family home every second count kidnapping case stake keep rising longer girl missing ava mason struggle hold family together darkest hour two investigator find drawn overall daphne du maurier award winner"
7997,133954,133954,3319458,374,451528719,9780451528710,1880,"Washington Square","Washington Square",NULL,3.67,12071,14611,"britain struggling survive roman invasion eilan daughter druidic warleader gifted vision marked fate become priestess forest fate also led eilan gaius soldier mixed blood son roman sent subdue native british gaius eilan felt forbidden love terrible secret haunt even anointed new high priestess mighty enemy poised destroy magic forest house shelter eilan must trust power great goddess lead treacherous labyrinth destiny"
7998,174879,174879,168933,45,039575531X,9780395755310,1961,"On Becoming a Person:  A Therapist's View of Psychotherapy","On Becoming a Person: A Therapist's View of Psychotherapy",NULL,4.11,9988,10370,"met carmel loan beautiful intelligent ambitious used getting want becomes infatuated fellow barrister hale allen going let little thing like married get way contact hire professional killer clara rinker get rid wife smart attractive rinker best hitwoman business thing go wrong amazing coincidence witness shooting witness cop brings deputy chief lucas davenport rinker must work together clean loose end includes getting davenport back whatever mean necessary"
8006,22674493,22674493,42179966,30,1478927941,9781478927940,2015,"NYPD Red 3","NYPD Red 3 (NYPD Red, #3)",NULL,4.03,6798,12121,"story relates progressive willful debasement young beautiful parisian fashion photographer want nothing slave lover rené test method psychological artistic interest precisely use erotic material also erotic method deliberate stimulation reader part mean total authentic literary new york time"
8014,155981,155981,150518,50,671700758,9780671700750,1960,"Psycho-Cybernetics. A New Way to Get More Living Out of Life","Psycho-Cybernetics, A New Way to Get More Living Out of Life",NULL,4.2,10652,11122,"ancient greek tell legend sculptor pygmalion created statue woman surpassing beauty fell love creation aphrodite taking pity man whose love could reach beyond barrier stone brought statue life gave pygmalion bride century later george bernard shaw captured magic legend celebrated play pygmalion pygmalion became henry higgins professor phonetics statue untutored flower girl street london barrier class shaw expected eliza end freddy run flower fair lady alan jay lerner take legend one step barrier swept away higgins eliza reunited curtain fall one loveliest musical play seven original broadway production seven film back cover"
8019,13152998,13152998,18153294,77,307594165,9780307594170,2011,Home,Home,NULL,3.71,11180,13478,"final chapter mercedes lackey spellbinding fantasy trilogy vanyel companion yfandes alone responsible saving kingdom valdemar force master wields dark forbidding magic either vanyel yfandes falter valdemar must pay ultimate price"
8028,58728,58728,13377363,54,553586386,9780553586380,1960,"Verhaaltjes, en gebeurtenissen uit het Achterhuis. Cady's leven","Anne Frank's Tales from the Secret Annex",NULL,4.23,10587,11235,"woman bear brother child boy brother leaf baby wood tell died natural cause discovering brother lie set forth alone find son brother sister wander countryside scourged three terrifying stranger toward apocalyptic resolution"
8030,512475,512475,4603746,64,743484274,9780743484280,1980,"The Cradle Will Fall","The Cradle Will Fall",NULL,3.89,14370,15666,"shadow torturer tale young severian apprentice guild torturer world called urth exiled committing ultimate sin profession showing mercy toward claw conciliator continues saga severian banished home undertakes mythic quest discover awesome power ancient relic learn truth hidden book new sun unanimously acclaimed gene wolfe remarkable work hailed masterpiece science fantasy comparable importance major work tolkien lewis publisher weekly one ambitious work speculative fiction twentieth century magazine fantasy science fiction shadow claw brings together first two book tetralogy one volume"
8033,21025,21025,22212,48,60938110,9780060938120,2001,"The Gift of Therapy: An Open Letter to a New Generation of Therapists and Their Patients","The Gift of Therapy: An Open Letter to a New Generation of Therapists and Their Patients",NULL,4.22,9569,10817,"joy anguish experience sexton fashioned poem told truth inner life men woman book comprises sexton ten volume verse including pulitzer live die well seven poem last year"
